<package id="2cefdc41-bb7c-48c7-9dd0-9f1975bcd502" xmlns="urn:nucleus/schemas/package/1.0" xmlns:xsi="http://www.w3.org/2001/XMLSchema-instance" xsi:schemaLocation="urn:nucleus/schemas/package/1.0 http://www.nucleus-cms.com/schemas/package.xsd">
  <name>Smtp Mail</name>
  <version>2.0.0</version>
  <publisher name="Inventua" url="https://www.inventua.com" email="support@inventua.com" />
  <description>
		Adds support for sending emails using SMTP.
	</description>
  <compatibility minVersion="2.0.0.0" maxVersion="2.*" />
  <components>
    <component folderName="Smtp Mail" optional="false">
      <file name="readme.txt" />
      <file name="license.txt" />
      <folder name="bin">
        <file name="Nucleus.Extensions.Smtp.dll" />
        <file name="MailKit.dll" />
        <file name="MimeKit.dll" />
        <file name="BouncyCastle.Cryptography.dll" />
        <file name="System.Security.Cryptography.Pkcs.dll" />
      </folder>
      <cleanup>
        <folder name="Views">
          <file name="_SmtpSettings.cshtml" />
          <file name="_PickupDirectorySettings.cshtml" />
        </folder>        
      </cleanup>
    </component>
  </components>
</package>