<?xml version="1.0" encoding="utf-8"?>
<package id="86246671-4a20-4803-a74a-48b3b2d1cc26" xmlns="urn:nucleus/schemas/package/1.0" xmlns:xsi="http://www.w3.org/2001/XMLSchema-instance" xsi:schemaLocation="urn:nucleus/schemas/package/1.0 http://www.nucleus-cms.com/schemas/package.xsd">
  <name>Multi-Content</name>
  <version>3.0.0</version>
  <publisher name="Inventua" url="https://www.inventua.com/nucleus/" email="support@inventua.com" />
  <description>
    Present content in various forms: alert, tabbed, carousel, accordion, grid, faq and plain.
  </description>
  <compatibility minVersion="3.0.0.0" maxVersion="3.*" />
  <components>
    <component folderName="MultiContent" optional="false">
      <moduleDefinition id="c690ad88-0438-48cf-b977-97fe53b7118f">
        <friendlyName>Multi-Content</friendlyName>
        <helpUrl>https://www.nucleus-cms.com/documentation/modules/multi-content/</helpUrl>
        <extension>MultiContent</extension>
        <viewController>MultiContent</viewController>
        <viewAction>Index</viewAction>
        <editAction>Settings</editAction>
        <categories>Content</categories>
      </moduleDefinition>
      <file name="readme.txt" />
      <file name="license.txt" />
      <folder name="bin">
        <file name="Nucleus.Modules.MultiContent.dll" />
      </folder>
      <cleanup>
        <file name="viewer.css" />
        <file name="settings.css" />
        <folder name="Views">
          <file name="Viewer.cshtml" />
          <file name="Settings.cshtml" />
          <file name="_ContentList.cshtml" />
          <file name="Editor.cshtml" />
          <folder name="ViewerLayouts">
            <file name="Accordion.cshtml" />
            <file name="Alert.cshtml" />
            <file name="Carousel.cshtml" />
            <file name="Tabs.cshtml" />
            <file name="Pills.cshtml" />
            <file name="Faq.cshtml" />
          </folder>
          <folder name="LayoutSettings">
            <file name="_AccordionSettings.cshtml" />
            <file name="_AlertSettings.cshtml" />
            <file name="_CarouselSettings.cshtml" />
            <file name="_TabsSettings.cshtml" />
            <file name="_PillsSettings.cshtml" />
            <file name="_FaqSettings.cshtml" />
          </folder>
        </folder>
      </cleanup>
    </component>
  </components>
</package>