<package id="1406f868-cfc0-473c-9122-8e7304edd91f" xmlns="urn:nucleus/schemas/package/1.0" xmlns:xsi="http://www.w3.org/2001/XMLSchema-instance" xsi:schemaLocation="urn:nucleus/schemas/package/1.0 http://www.nucleus-cms.com/schemas/package.xsd">
  <name>TypeSense</name>
  <version>1.0.0.0</version>
  <publisher name="Inventua" url="https://www.inventua.com/nucleus" email="support@inventua.com" />
  <description>
		Search provider for TypeSense.
	</description>
  <compatibility minVersion="2.1.0.0" maxVersion="*" />
  <components>
    <component folderName="TypeSense" optional="false">
      <controlPanelExtensionDefinition id="d14d2458-9f38-4aae-9275-153eb729d679">
        <friendlyName>TypeSense</friendlyName>
        <helpUrl>https://www.nucleus-cms.com/other-extensions/typesense-search/</helpUrl>
        <description>Configure TypeSense Search settings.</description>
        <controllerName>TypeSenseSettingsController</controllerName>
        <extensionName>TypeSense</extensionName>
        <scope>Site</scope>
        <editAction>Settings</editAction>
        <icon><![CDATA[&#xf02f;]]></icon>
      </controlPanelExtensionDefinition>
      <file name="readme.txt" />
      <!-- 
        when the project property GenerateEmbeddedFilesManifest=true and your static resources Build Action=Embedded resource, static resource
        files do not need to be included in package.xml (this file) 
      -->
      <!--<file name="viewer.css" />
			<file name="settings.css" />-->
      <folder name="bin">
        <file name="Nucleus.Extensions.TypeSense.dll" />
        <file name="Typesense.dll" />
      </folder>
      <!-- 
        when the project property RazorCompileOnBuild=true view (.cshtml) files do not need to be included in package.xml (this file) 
      -->
      <!--<folder name="Views">
				<file name="_ViewImports.cshtml" />
				<file name="Viewer.cshtml" />
				<file name="Settings.cshtml" />
			</folder>-->
      <cleanup>
        <folder name="bin">
          <file name="HtmlAgilityPack.dll" />
        </folder>
      </cleanup>
    </component>
  </components>
</package>