<package id="83aac7bc-fb2d-4d0e-ac9b-63f381711851" xmlns="urn:nucleus/schemas/package/1.0" xmlns:xsi="http://www.w3.org/2001/XMLSchema-instance" xsi:schemaLocation="urn:nucleus/schemas/package/1.0 http://www.nucleus-cms.com/schemas/package.xsd">
  <name>AzureEmailCommunications</name>
  <version>1.0.0</version>
  <publisher name="Inventua" url="https://www.inventua.com/nucleus/" email="support@inventua.com" />
  <description>
		Adds support for sending emails using a Azure Email Communications service.
	</description>
  <compatibility minVersion="2.0.0.0" maxVersion="*" />
  <components>
    <component folderName="AzureEmailCommunications" optional="false">
      <file name="readme.txt" />
      <!-- 
        when the project property GenerateEmbeddedFilesManifest=true and your static resources Build Action=Embedded resource, static resource
        files do not need to be included in package.xml (this file) 
      -->
      <!--<file name="viewer.css" />
			<file name="settings.css" />-->
      <file name="license.txt" />
      <folder name="bin">
        <file name="Nucleus.Extensions.AzureEmailCommunications.dll" />
        <file name="Azure.Communication.Email.dll" />
      </folder>
      <!-- 
        when the project property RazorCompileOnBuild=true view (.cshtml) files do not need to be included in package.xml (this file) 
      -->
      <!--<folder name="Views">
				<file name="_ViewImports.cshtml" />
				<file name="Viewer.cshtml" />
				<file name="Settings.cshtml" />
			</folder>-->
    </component>
  </components>
</package>