<package id="2818e5f6-9868-4d65-ac7c-4a57179dbc99" xmlns="urn:nucleus/schemas/package/1.0" xmlns:xsi="http://www.w3.org/2001/XMLSchema-instance" xsi:schemaLocation="urn:nucleus/schemas/package/1.0 http://www.nucleus-cms.com/schemas/package.xsd">
  <name>AzureSearch</name>
  <version>1.0.0.0</version>
  <publisher name="Inventua" url="https://www.inventua.com" email="support@inventua,.com" />
  <description>
		Nucleus search providers for Azure Search.
	</description>
  <compatibility minVersion="2.0.0.1" maxVersion="*" />
  <components>
    <component folderName="AzureSearch" optional="false">
      <controlPanelExtensionDefinition id="204D31FE-3B6B-47F8-B435-B8470F6462D5">
        <friendlyName>Azure Search Settings</friendlyName>
        <helpUrl>https://www.nucleus-cms.com/other-extensions/azure-search/</helpUrl>
        <description>Configure Azure Search settings.</description>
        <controllerName>AzureSearchSettings</controllerName>
        <extensionName>AzureSearch</extensionName>
        <scope>Site</scope>
        <editAction>Settings</editAction>
        <icon><![CDATA[&#xf02f;]]></icon>
      </controlPanelExtensionDefinition>
      <file name="readme.txt" />
      <!-- 
        when the project property GenerateEmbeddedFilesManifest=true and your static resources Build Action=Embedded resource, static resource
        files do not need to be included in package.xml (this file) 
      -->
      <!--<file name="viewer.css" />
			<file name="settings.css" />-->
      <folder name="bin">
        <file name="Nucleus.Extensions.AzureSearch.dll" />
        <file name="Azure.Core.dll" />
        <file name="System.ClientModel.dll" />
        <file name="Azure.Search.Documents.dll" />
        <file name="HtmlAgilityPack.dll" />
        <file name="Microsoft.Bcl.AsyncInterfaces.dll" />
        <file name="OpenAI.dll" />
        <file name="Azure.AI.OpenAI.dll" />
      </folder>
      <!-- 
        when the project property RazorCompileOnBuild=true view (.cshtml) files do not need to be included in package.xml (this file) 
      -->
      <!--<folder name="Views">
				<file name="_ViewImports.cshtml" />
				<file name="Viewer.cshtml" />
				<file name="Settings.cshtml" />
			</folder>-->
    </component>
  </components>
</package>