<?xml version="1.0" encoding="utf-8"?>
<package id="4a09ada0-75a4-4d1e-ab1b-cabbd5d2f481" 
         xmlns="urn:nucleus/schemas/package/1.0"
         xmlns:xsi="http://www.w3.org/2001/XMLSchema-instance"
         xsi:schemaLocation="urn:nucleus/schemas/package/1.0 http://www.nucleus-cms.com/schemas/package.xsd">
  <name>User Accounts</name>
  <version>1.0.1</version>
  <publisher name="Inventua" url="http://www.inventua.com" email="support@inventua.com" />
  <description>
		Application install set for the core user account modules (signup and login).			
	</description>
  <compatibility minVersion="1.0.0.0" maxVersion="*" />
  <components>
    <component folderName="Account" optional="false">
      <moduleDefinition id="f0a9ec71-c29e-436e-96e1-72dcdc44c32b">
        <friendlyName>Login</friendlyName>
        <extension>Account</extension>
        <viewController>Login</viewController>
        <viewAction>Index</viewAction>
        <editAction>Edit</editAction>
        <categories>Authentication,Account Management</categories>
      </moduleDefinition>
      <moduleDefinition id="7b25bdaf-14a3-4bad-9c41-972dbbb384a1">
        <friendlyName>User Signup</friendlyName>
        <extension>Account</extension>
        <viewController>Signup</viewController>
        <viewAction>Index</viewAction>
        <editAction>Edit</editAction>
        <categories>Account Management</categories>
      </moduleDefinition>
      <moduleDefinition id="530efacf-b9ff-4bf1-94d9-c357fc8769ed">
        <friendlyName>Change Password</friendlyName>
        <extension>Account</extension>
        <viewController>ChangePassword</viewController>
        <viewAction>Index</viewAction>
        <editAction>Edit</editAction>
        <categories>Account Management</categories>
      </moduleDefinition>
      <moduleDefinition id="1f347233-99e1-47b8-aa78-90ec16c6dbd2">
        <friendlyName>User Profile</friendlyName>
        <extension>Account</extension>
        <viewController>UserProfile</viewController>
        <viewAction>Index</viewAction>
        <editAction>Edit</editAction>
        <categories>Account Management</categories>
      </moduleDefinition>
      <file name="readme.txt" />
      <file name="license.txt" />
      <folder name="Bin">
        <file name="Nucleus.Modules.Account.dll" />
      </folder>
      <folder name="Views">
        <file name="Signup.cshtml" />
        <file name="SignupSettings.cshtml" />
        <file name="Login.cshtml" />
        <file name="Settings.cshtml" />
        <file name="Recover.cshtml" />
        <file name="ChangePassword.cshtml" />
        <file name="ChangePasswordSettings.cshtml" />
        <file name="UserProfile.cshtml" />
        <file name="UserProfileSettings.cshtml" />
      </folder>
    </component>
  </components>
</package>