<?xml version="1.0" encoding="utf-8"?>
<package id="407c40be-6025-4a7a-bc41-e07e0ae5f917" xmlns="urn:nucleus/schemas/package/1.0" xmlns:xsi="http://www.w3.org/2001/XMLSchema-instance" xsi:schemaLocation="urn:nucleus/schemas/package/1.0 http://www.nucleus-cms.com/schemas/package.xsd">
  <name>Links</name>
  <version>1.2.1</version>
  <publisher name="Inventua" url="http://www.inventua.com" email="support@inventua.com" />
  <description>
		Display a list of links to selected pages, external Urls or files.
	</description>
  <compatibility minVersion="1.2.2.0" maxVersion="*" />
  <components>
    <component folderName="Links" optional="false">
      <moduleDefinition id="374e62b5-024d-4d8d-95a2-e56f476fe887">
        <friendlyName>Links</friendlyName>
        <extension>Links</extension>
        <viewController>Links</viewController>
        <settingsController>Admin</settingsController>
        <viewAction>Index</viewAction>
        <editAction>Settings</editAction>
        <categories>Content</categories>
      </moduleDefinition>
      <file name="readme.txt" />
      <file name="license.txt" />
      <file name="viewer.css" />
      <file name="settings.css" />
      <folder name="Bin">
        <file name="Nucleus.Modules.Links.dll" />
      </folder>
      <folder name="Views">
        <file name="Viewer.cshtml" />
        <file name="Settings.cshtml" />
        <file name="_LinksList.cshtml" />
        <file name="_PageMenu.cshtml" />
        <file name="Editor.cshtml" />
        <folder name="ViewerLayouts">
          <file name="Table.cshtml" />
          <file name="Ordered List.cshtml" />
          <file name="Unordered List.cshtml" />
          <file name="Tile.cshtml" />
          <file name="Tile.css" />
        </folder>
      </folder>
    </component>
  </components>
</package>