<package id="22fd6994-e5b6-4215-b64f-1be4f85aa6eb" xmlns="urn:nucleus/schemas/package/1.0" xmlns:xsi="http://www.w3.org/2001/XMLSchema-instance" xsi:schemaLocation="urn:nucleus/schemas/package/1.0 http://www.nucleus-cms.com/schemas/package.xsd">
  <name>SAML Server</name>
  <version>2.0.0</version>
  <publisher name="Inventua" url="https://www.inventua.com/nucleus/" email="support@inventua.com" />
  <description>
		The SAML server extension implements the SAML2 protocol to provide authentication (single-signon) services 
		to other web sites and applications. Users can use their Nucleus credentials to access web sites which are 
		configured to use Nucleus as their SAML2 identity provider.
	</description>
  <compatibility minVersion="2.0.0.0" maxVersion="2.*" />
  <components>
    <component folderName="SAMLServer" optional="false">
      <controlPanelExtensionDefinition id="01CC95F7-20AD-4776-97A9-40B32F6D0968">
        <friendlyName>SAML Server</friendlyName>
        <description>Configure SAML server.</description>
        <controllerName>SAMLServerAdmin</controllerName>
        <extensionName>SAMLServer</extensionName>
        <scope>Site</scope>
        <editAction>Settings</editAction>
      </controlPanelExtensionDefinition>
      <file name="readme.txt" />
      <file name="license.txt" />
      <file name="settings.css" />
      <file name="_ViewImports.cshtml" />
      <folder name="bin">
        <file name="Nucleus.SAML.Server.dll" />
        <file name="ITfoxtec.Identity.Saml2.dll" />
        <file name="ITfoxtec.Identity.Saml2.MvcCore.dll" />
        <file name="Microsoft.IdentityModel.Abstractions.dll" />
        <file name="Microsoft.IdentityModel.JsonWebTokens.dll" />
        <file name="Microsoft.IdentityModel.Logging.dll" />
        <file name="Microsoft.IdentityModel.Tokens.dll" />
        <file name="Microsoft.IdentityModel.Tokens.Saml.dll" />
        <file name="Microsoft.IdentityModel.Xml.dll" />
        <file name="System.IdentityModel.Tokens.Jwt.dll" />
        <file name="System.ServiceModel.Primitives.dll" />
        <file name="System.ServiceModel.Security.dll" />
      </folder>
      <folder name="Views">
        <file name="Settings.cshtml" />
        <file name="Editor.cshtml" />
        <file name="_ClientAppsList.cshtml" />
        <file name="_PageMenu.cshtml" />
      </folder>
      <cleanup>
        <!-- assemblies from version 1.3.0 which are no longer used  -->
        <folder name="bin">
          <file name="Microsoft.Bcl.AsyncInterfaces.dll" />
          <file name="System.ServiceModel.dll" />
          <file name="System.Private.ServiceModel.dll" />
        </folder>
      </cleanup>
    </component>
  </components>
</package>