<?xml version="1.0" encoding="utf-8"?>
<package id="5a74caf7-c328-466c-85aa-db9861c44700" xmlns="urn:nucleus/schemas/package/1.0" xmlns:xsi="http://www.w3.org/2001/XMLSchema-instance" xsi:schemaLocation="urn:nucleus/schemas/package/1.0 http://www.nucleus-cms.com/schemas/package.xsd">
  <name>Google Analytics</name>
  <version>2.0.0</version>
  <publisher name="Inventua" url="https://www.inventua.com/nucleus/" email="support@inventua.com" />
  <description>
    Use this extension to add Google Analytics reporting to your site.
  </description>
  <compatibility minVersion="2.0.0.0" maxVersion="2.*" />
  <components>
    <component folderName="GoogleAnalytics" optional="false">
      <controlPanelExtensionDefinition id="955b089f-f002-446e-bde0-71f3fe64caab">
        <friendlyName>Google Analytics</friendlyName>
        <description>Configure Google Analytics settings.</description>
        <controllerName>GoogleAnalytics</controllerName>
        <extensionName>GoogleAnalytics</extensionName>
        <scope>Site</scope>
        <editAction>Settings</editAction>
        <icon><![CDATA[&#xef3e;]]></icon>
      </controlPanelExtensionDefinition>
      <file name="readme.txt" />
      <file name="license.txt" />
      <folder name="bin">
        <file name="Nucleus.Extensions.GoogleAnalytics.dll" />
      </folder>
      <cleanup>
        <file name="settings.css" />
        <file name="viewer.css" />
        <folder name="Views">
          <file name="Settings.cshtml" />
          <file name="AnalyticsScript.cshtml" />
        </folder>
      </cleanup>
    </component>
  </components>
</package>