<?xml version="1.0" encoding="utf-8"?>
<package id="0A536478-E9A3-4DB6-9D1A-0583B0710B5B" xmlns="urn:nucleus/schemas/package/1.0" xmlns:xsi="http://www.w3.org/2001/XMLSchema-instance" xsi:schemaLocation="urn:nucleus/schemas/package/1.0 http://www.nucleus-cms.com/schemas/package.xsd">
  <name>Media</name>
  <version>1.3.0</version>
  <publisher name="Inventua" url="http://www.inventua.com" email="support@inventua.com" />
  <description>
    The media module presents multimedia content on a page.  It can be used to show video, images, PDF documents within your page, and will render a download link for other file types.
  </description>
  <compatibility minVersion="1.3.0.0" maxVersion="*" />
  <components>
    <component folderName="Media" optional="false">
      <moduleDefinition id="2ffdf8a4-edab-48e5-80c6-7b068e4721bb">
        <friendlyName>Media</friendlyName>
        <extension>Media</extension>
        <viewController>Media</viewController>
        <viewAction>Index</viewAction>
        <editAction>Edit</editAction>
        <categories>Content,Media</categories>
      </moduleDefinition>
      <file name="readme.txt" />
      <file name="license.txt" />
      <file name="_ViewImports.cshtml" />
      <file name="media.css" />
      <folder name="Bin">
        <file name="Nucleus.Modules.Media.dll" />
      </folder>
      <folder name="Views">
        <file name="Viewer.cshtml" />
        <file name="Settings.cshtml" />
      </folder>
    </component>
  </components>
</package>