<?xml version="1.0" encoding="utf-8"?>
<package id="4036fdb6-6114-4740-b3c4-d3dbc8f37540" xmlns="urn:nucleus/schemas/package/1.0" xmlns:xsi="http://www.w3.org/2001/XMLSchema-instance" xsi:schemaLocation="urn:nucleus/schemas/package/1.0 http://www.nucleus-cms.com/schemas/package.xsd">
  <name>Text/Html</name>
  <version>2.0.0</version>
  <publisher name="Inventua" url="https://www.inventua.com/nucleus/" email="support@inventua.com" />
  <description>
    The Text/HTML module renders HTML or text content.  You can set formatting, bold/italic, insert links to other web sites, page 
    links and image links, and add lists. 
  </description>
  <compatibility minVersion="2.0.0.0" maxVersion="2.*" />
  <components>
    <component folderName="TextHtml" optional="false">
      <moduleDefinition id="b516d8dd-c793-4776-be33-902eb704bef6">
        <friendlyName>Html</friendlyName>
        <helpUrl>https://www.nucleus-cms.com/documentation/modules/texthtml/</helpUrl>
        <extension>TextHtml</extension>
        <viewController>TextHtml</viewController>
        <viewAction>Index</viewAction>
        <editAction>Edit</editAction>
        <categories>Content</categories>
      </moduleDefinition>
      <file name="readme.txt" />
      <file name="license.txt" />
      <folder name="bin">
        <file name="Nucleus.Modules.TextHtml.dll" />
      </folder>
      <cleanup>        
        <folder name="Views">
          <file name="Viewer.cshtml" />
          <file name="Settings.cshtml" />
        </folder>
      </cleanup>
    </component>
  </components>
</package>