<package id="fdcdf6c6-9cc2-48db-990d-c33d2cc6d640" xmlns="urn:nucleus/schemas/package/1.0" xmlns:xsi="http://www.w3.org/2001/XMLSchema-instance" xsi:schemaLocation="urn:nucleus/schemas/package/1.0 http://www.nucleus-cms.com/schemas/package.xsd">
  <name>PageLinks</name>
  <version>2.0.0</version>
  <publisher name="Inventua" url="https://www.inventua.com" email="support@inventua.com" />
  <description>
    Displays a list of link targets for the current page.
  </description>
  <compatibility minVersion="2.0.0.0" maxVersion="2.*" />
  <components>
    <component folderName="PageLinks" optional="false">
      <moduleDefinition id="ed660e12-28c4-4baa-9dbe-d530f848a277">
        <friendlyName>Page Links</friendlyName>
        <!--<helpUrl>https://www.nucleus-cms.com/documentation/modules/page-links/</helpUrl>-->
        <extension>PageLinks</extension>
        <viewController>PageLinksViewerController</viewController>
        <settingsController>PageLinksSettingsController</settingsController>
        <viewAction>Index</viewAction>
        <editAction>Settings</editAction>
        <categories>Navigation</categories>
      </moduleDefinition>
      <file name="readme.txt" />
      <folder name="bin">
        <file name="Nucleus.Modules.PageLinks.dll" />
      </folder>
      <cleanup>
        <file name="viewer.css" />
        <file name="settings.css" />
        <file name="viewer.js" />
        <file name="viewer.min.js" />
        <file name="viewer.min.css" />
        <folder name="Views">
          <file name="_PageLinksList.cshtml" />
          <file name="Viewer.cshtml" />
          <file name="Settings.cshtml" />
        </folder>
      </cleanup>
    </component>
  </components>
</package>