<package id="36bc8fd3-8e51-485f-8f38-4b9bcd41a80f" xmlns="urn:nucleus/schemas/package/1.0" xmlns:xsi="http://www.w3.org/2001/XMLSchema-instance" xsi:schemaLocation="urn:nucleus/schemas/package/1.0 http://www.nucleus-cms.com/schemas/package.xsd">
  <name>FilesList</name>
  <version>2.0.0</version>
  <publisher name="Inventua" url="https://www.inventua.com/nucleus/" email="support@inventua.com" />
  <description>
    The Files List module presents a list of downloadable files from the specified folder.
  </description>
  <compatibility minVersion="2.0.0.0" maxVersion="2.*" />
  <components>
    <component folderName="FilesList" optional="false">
      <moduleDefinition id="aebc3074-528f-4e71-84b9-1fbb5de2b8e2">
        <friendlyName>Files List</friendlyName>
        <helpUrl>https://www.nucleus-cms.com/documentation/modules/files-list/</helpUrl>
        <extension>FilesList</extension>
        <viewController>FilesListViewerController</viewController>
        <settingsController>FilesListSettingsController</settingsController>
        <viewAction>Index</viewAction>
        <editAction>Settings</editAction>
        <categories>Content</categories>
      </moduleDefinition>
      <file name="readme.txt" />
      <file name="license.txt" />
      <folder name="bin">
        <file name="Nucleus.Modules.FilesList.dll" />
      </folder>
      <cleanup>
        <file name="viewer.css" />
        <file name="settings.css" />
        <folder name="Views">
          <file name="_ViewImports.cshtml" />
          <file name="Viewer.cshtml" />
          <file name="Settings.cshtml" />
          <folder name="ViewerLayouts">
            <file name="Table.cshtml" />
            <file name="Ordered List.cshtml" />
            <file name="Unordered List.cshtml" />
            <file name="Tile.cshtml" />
          </folder>
        </folder>
      </cleanup>
    </component>
  </components>
</package>