<package id="ea9fa093-ba1a-4a04-bfee-9786ec4beda5" xmlns="urn:nucleus/schemas/package/1.0" xmlns:xsi="http://www.w3.org/2001/XMLSchema-instance" xsi:schemaLocation="urn:nucleus/schemas/package/1.0 http://www.nucleus-cms.com/schemas/package.xsd">
  <name>Forums</name>
  <version>3.0.1</version>
  <publisher name="Inventua" url="https://www.inventua.com/nucleus/" email="support@inventua.com" />
  <description>
    The forums module is a message board which allows your user community to participate in discussions, post questions and answers.
  </description>
  <compatibility minVersion="3.0.0.0" maxVersion="3.*" />
  <components>
    <component folderName="Forums" optional="false">
      <moduleDefinition id="ea9b5d66-b791-414c-8c52-a20536cfa9f5">
        <friendlyName>Forums</friendlyName>
        <helpUrl>https://www.nucleus-cms.com/documentation/modules/forums/</helpUrl>
        <extension>Forums</extension>
        <viewController>Forums</viewController>
        <settingsController>ForumsAdmin</settingsController>
        <viewAction>Index</viewAction>
        <editAction>Settings</editAction>
        <categories>Content,Social</categories>
      </moduleDefinition>
      <file name="readme.txt" />
      <file name="license.txt" />
      <file name="viewer.css" />
      <file name="settings.css" />
      <file name="viewer.min.css" />
      <file name="settings.min.css" />
      <folder name="bin">
        <file name="Nucleus.Modules.Forums.dll" />
      </folder>
      <folder name="Views">
        <file name="ListForums.cshtml" />
        <file name="ViewForum.cshtml" />
        <file name="Settings.cshtml" />
        <file name="GroupEditor.cshtml" />
        <file name="_GroupPermissions.cshtml" />
        <file name="_ForumList.cshtml" />
        <file name="ForumEditor.cshtml" />
        <file name="ViewPost.cshtml" />
        <file name="EditPost.cshtml" />
        <file name="ReplyPost.cshtml" />
        <file name="ManageSubscriptions.cshtml" />
      </folder>
    </component>
  </components>
</package>